generators/autotest/test_fqm_constant_pq_converted.json

{
  "_directives": {
    "#set": {
      "profiler": "1;",
      "iteration_limit": "100000;",
      "relax_naming_rules": "1;"
    }
  },
  "clock": {
    "timezone": "EST+5EDT",
    "starttime": "'2014-01-01 0:00:00'",
    "stoptime": "'2014-01-02 0:00:00'"
  },
  "modules": {
    "generators": {},
    "powerflow": {
      "solver_method": "NR"
    },
    "tape": {},
    "assert": {}
  },
  "objects": {
    "overhead_line_conductor": {
      "instances": [
        {
          "name": "conductor1",
          "geometric_mean_radius": 0.0313,
          "resistance": 0.1859,
          "outside_comments": [
            "// Phase Conductor 556,500 26/7 ACSR"
          ]
        },
        {
          "name": "conductor2",
          "geometric_mean_radius": 0.00814,
          "resistance": 0.592,
          "outside_comments": [
            "// Phase Conductor 4/0 6/1 ACSR"
          ]
        },
        {
          "name": "conductor3",
          "geometric_mean_radius": 0.00446,
          "resistance": 1.12,
          "outside_comments": [
            "// Phase Conductor 1/0 ACSR"
          ]
        }
      ]
    },
    "underground_line_conductor": {
      "instances": [
        {
          "name": "conductor4",
          "outer_diameter": 1.29,
          "conductor_gmr": 0.0171,
          "conductor_diameter": 0.567,
          "conductor_resistance": 0.41,
          "neutral_gmr": 0.00208,
          "neutral_resistance": 14.872,
          "neutral_diameter": 0.0640837,
          "neutral_strands": 13.0,
          "shield_gmr": 0.0,
          "shield_resistance": 0.0,
          "outside_comments": [
            "// Phase Conductor 250,000 AA,CN"
          ]
        },
        {
          "name": "conductor5",
          "outer_diameter": 1.06,
          "conductor_gmr": 0.0111,
          "conductor_diameter": 0.368,
          "conductor_resistance": 0.97,
          "neutral_gmr": 0.0111,
          "neutral_resistance": 0.97,
          "neutral_diameter": 0.0640837,
          "neutral_strands": 6.0,
          "shield_gmr": 0.0,
          "shield_resistance": 0.0,
          "outside_comments": [
            "// Phase Conductor 1/0 AA,TS N: 1/0 Cu"
          ],
          "inline_comments": {
            "neutral_resistance": "// Unsure whether this is correct"
          }
        }
      ]
    },
    "line_spacing": {
      "instances": [
        {
          "name": "line_spacing1",
          "distance_AB": 2.5,
          "distance_AC": 4.5,
          "distance_BC": 7.0,
          "distance_BN": 5.656854,
          "distance_AN": 4.272002,
          "distance_CN": 5.0,
          "outside_comments": [
            "// Overhead line spacings",
            "// ID-500abcn"
          ]
        },
        {
          "name": "line_spacing2",
          "distance_AC": 2.5,
          "distance_AB": 4.5,
          "distance_BC": 7.0,
          "distance_CN": 5.656854,
          "distance_AN": 4.272002,
          "distance_BN": 5.0,
          "outside_comments": [
            "// ID-500 acbn"
          ]
        },
        {
          "name": "line_spacing3",
          "distance_AC": 0.0,
          "distance_AB": 0.0,
          "distance_BC": 7.0,
          "distance_AN": 0.0,
          "distance_CN": 5.656854,
          "distance_BN": 5.0,
          "outside_comments": [
            "// ID-505 bcn"
          ]
        },
        {
          "name": "line_spacing4",
          "distance_AC": 7.0,
          "distance_AB": 0.0,
          "distance_BC": 0.0,
          "distance_AN": 5.656854,
          "distance_CN": 5.0,
          "distance_BN": 0.0,
          "outside_comments": [
            "// ID-505 acn"
          ]
        },
        {
          "name": "line_spacing5",
          "distance_AC": 0.0,
          "distance_AB": 0.0,
          "distance_BC": 0.0,
          "distance_AN": 0.0,
          "distance_CN": 5.0,
          "distance_BN": 0.0,
          "outside_comments": [
            "// ID-510 cn"
          ]
        },
        {
          "name": "line_spacing6",
          "distance_AB": 0.5,
          "distance_BC": 0.5,
          "distance_AC": 1.0,
          "distance_AN": 0.0,
          "distance_BN": 0.0,
          "distance_CN": 0.0,
          "outside_comments": [
            "// ID-515 abc",
            "//Underground line spacing"
          ]
        },
        {
          "name": "line_spacing_7",
          "distance_AB": 0.0,
          "distance_BC": 0.0,
          "distance_AC": 0.0,
          "distance_AN": 0.083333,
          "distance_BN": 0.0,
          "distance_CN": 0.0,
          "outside_comments": [
            "// ID-520 an"
          ]
        }
      ]
    },
    "line_configuration": {
      "instances": [
        {
          "name": "line_configuration1",
          "conductor_A": "conductor1",
          "conductor_B": "conductor1",
          "conductor_C": "conductor1",
          "conductor_N": "conductor2",
          "spacing": "line_spacing1",
          "outside_comments": [
            "// Line configurations",
            "// Configuration 601"
          ]
        },
        {
          "name": "line_configuration2",
          "conductor_A": "conductor2",
          "conductor_B": "conductor2",
          "conductor_C": "conductor2",
          "conductor_N": "conductor2",
          "spacing": "line_spacing2",
          "outside_comments": [
            "// Configuration 602"
          ]
        },
        {
          "name": "line_configuration3",
          "conductor_B": "conductor3",
          "conductor_C": "conductor3",
          "conductor_N": "conductor3",
          "spacing": "line_spacing3",
          "outside_comments": [
            "// Configuration 603"
          ]
        },
        {
          "name": "line_configuration4",
          "conductor_A": "conductor3",
          "conductor_C": "conductor3",
          "conductor_N": "conductor3",
          "spacing": "line_spacing4",
          "outside_comments": [
            "// Configuration 604"
          ]
        },
        {
          "name": "line_configuration5",
          "conductor_C": "conductor3",
          "conductor_N": "conductor3",
          "spacing": "line_spacing5",
          "outside_comments": [
            "// Configuration 605"
          ]
        },
        {
          "name": "line_configuration6",
          "conductor_A": "conductor4",
          "conductor_B": "conductor4",
          "conductor_C": "conductor4",
          "spacing": "line_spacing6",
          "outside_comments": [
            "// Configuration 606"
          ]
        },
        {
          "name": "line_configuration7",
          "conductor_A": "conductor5",
          "conductor_N": "conductor5",
          "spacing": "line_spacing6",
          "outside_comments": [
            "// Configuration 607"
          ]
        }
      ]
    },
    "transformer_configuration": {
      "instances": [
        {
          "name": "transformer_configuration1",
          "connect_type": "WYE_WYE",
          "install_type": "PADMOUNT",
          "power_rating": 50000,
          "primary_voltage": 4160,
          "secondary_voltage": 480,
          "resistance": 0.011,
          "reactance": 0.02,
          "outside_comments": [
            "// Transformer configuration"
          ]
        }
      ]
    },
    "regulator_configuration": {
      "instances": [
        {
          "name": "regulator_configuration1",
          "connect_type": "WYE_WYE",
          "band_center": 2300,
          "band_width": 20.0,
          "time_delay": 30.0,
          "raise_taps": 16,
          "lower_taps": 16,
          "regulation": 0.1,
          "Control": "REMOTE_NODE",
          "outside_comments": [
            "// Regulator configuration"
          ],
          "inside_comments": [
            "//tap_pos_A 10; // Only state these if in manual mode",
            "//tap_pos_B 8;",
            "//tap_pos_C 11;"
          ],
          "inline_comments": {
            "Control": "// MANUAL OUTPUT_VOLTAGE;"
          }
        }
      ]
    },
    "overhead_line": {
      "instances": [
        {
          "name": "overhead_line1",
          "phases": "BCN",
          "from": "Node632",
          "to": "Load645",
          "length": 500,
          "configuration": "line_configuration3",
          "outside_comments": [
            "// Define line objects"
          ]
        },
        {
          "name": "overhead_line2",
          "phases": "BCN",
          "from": "Load645",
          "to": "Load646",
          "length": 300,
          "configuration": "line_configuration3"
        },
        {
          "name": "overhead_line3",
          "phases": "ABCN",
          "from": "Node630",
          "to": "Node632",
          "length": 2000,
          "configuration": "line_configuration1"
        },
        {
          "name": "overhead_line4",
          "phases": "ABCN",
          "from": "Node632",
          "to": "Load6321",
          "length": 500,
          "configuration": "line_configuration1",
          "outside_comments": [
            "//Split line for distributed load"
          ]
        },
        {
          "name": "overhead_line5",
          "phases": "ABCN",
          "from": "Load6321",
          "to": "Load671",
          "length": 1500,
          "configuration": "line_configuration1"
        },
        {
          "name": "overhead_line6",
          "phases": "ABCN",
          "from": "Load671",
          "to": "Load680",
          "length": 1000,
          "configuration": "line_configuration1",
          "outside_comments": [
            "//End split line"
          ],
          "inline_comments": {
            "to": "//converted from node to load"
          }
        },
        {
          "name": "overhead_line7",
          "phases": "ACN",
          "from": "Load671",
          "to": "Node684",
          "length": 300,
          "configuration": "line_configuration4"
        },
        {
          "name": "overhead_line8",
          "phases": "CN",
          "from": "Node684",
          "to": "Load611",
          "length": 300,
          "configuration": "line_configuration5"
        },
        {
          "name": "overhead_line11",
          "phases": "ABCN",
          "from": "Node632",
          "to": "Node633",
          "length": 500,
          "configuration": "line_configuration2"
        }
      ]
    },
    "underground_line": {
      "instances": [
        {
          "name": "overhead_line9",
          "phases": "AN",
          "from": "Node684",
          "to": "Load652",
          "length": 800,
          "configuration": "line_configuration7"
        },
        {
          "name": "overhead_line10",
          "phases": "ABC",
          "from": "Load692",
          "to": "Load675",
          "length": 500,
          "configuration": "line_configuration6"
        }
      ]
    },
    "meter": {
      "instances": [
        {
          "name": "Node633",
          "phases": "ABCN",
          "voltage_A": 2401.7771,
          "voltage_B": "-1200.8886-2080.000j",
          "voltage_C": "-1200.8886+2080.000j",
          "nominal_voltage": 2401.7771,
          "outside_comments": [
            "// Create node objects"
          ]
        },
        {
          "name": "battery_meter_1",
          "parent": "Node633",
          "phases": "ABCN",
          "nominal_voltage": 2401.7771
        }
      ]
    },
    "node": {
      "instances": [
        {
          "name": "Node630",
          "phases": "ABCN",
          "voltage_A": "2401.7771+0j",
          "voltage_B": "-1200.8886-2080.000j",
          "voltage_C": "-1200.8886+2080.000j",
          "nominal_voltage": 2401.7771
        },
        {
          "name": "Node632",
          "phases": "ABCN",
          "voltage_A": 2401.7771,
          "voltage_B": "-1200.8886-2080.000j",
          "voltage_C": "-1200.8886+2080.000j",
          "nominal_voltage": 2401.7771
        },
        {
          "name": "Node650",
          "phases": "ABCN",
          "bustype": "SWING",
          "voltage_A": 2401.7771,
          "voltage_B": "-1200.8886-2080.000j",
          "voltage_C": "-1200.8886+2080.000j",
          "nominal_voltage": 2401.7771
        },
        {
          "name": "Node684",
          "phases": "ACN",
          "voltage_A": 2401.7771,
          "voltage_B": "-1200.8886-2080.000j",
          "voltage_C": "-1200.8886+2080.000j",
          "nominal_voltage": 2401.7771
        }
      ]
    },
    "load": {
      "instances": [
        {
          "name": "Load634",
          "phases": "ABCN",
          "voltage_A": "480.000+0j",
          "voltage_B": "-240.000-415.6922j",
          "voltage_C": "-240.000+415.6922j",
          "nominal_voltage": 480.0,
          "constant_power_A": "150000+110000j",
          "constant_power_B": "150000+110000j",
          "constant_power_C": "150000+110000j",
          "outside_comments": [
            "// Create load objects"
          ]
        },
        {
          "name": "Load645",
          "phases": "BCN",
          "voltage_A": 2401.7771,
          "voltage_B": "-1200.8886-2080.000j",
          "voltage_C": "-1200.8886+2080.000j",
          "constant_power_B": "170000+125000j",
          "nominal_voltage": 2401.7771
        },
        {
          "name": "Load646",
          "phases": "BCD",
          "voltage_A": 2401.7771,
          "voltage_B": "-1200.8886-2080.000j",
          "voltage_C": "-1200.8886+2080.000j",
          "constant_impedance_B": "56.5993+32.4831j",
          "nominal_voltage": 2401.7771
        },
        {
          "name": "Load652",
          "phases": "AN",
          "voltage_A": 2401.7771,
          "voltage_B": "-1200.8886-2080.000j",
          "voltage_C": "-1200.8886+2080.000j",
          "constant_impedance_A": "31.0501+20.8618j",
          "nominal_voltage": 2401.7771
        },
        {
          "name": "Load671",
          "phases": "ABCD",
          "voltage_A": 2401.7771,
          "voltage_B": "-1200.8886-2080.000j",
          "voltage_C": "-1200.8886+2080.000j",
          "constant_power_A": "385000+220000j",
          "constant_power_B": "385000+220000j",
          "constant_power_C": "385000+220000j",
          "nominal_voltage": 2401.7771
        },
        {
          "name": "Load675",
          "phases": "ABC",
          "voltage_A": 2401.7771,
          "voltage_B": "-1200.8886-2080.000j",
          "voltage_C": "-1200.8886+2080.000j",
          "constant_power_A": "485000+190000j",
          "constant_power_B": "68000+60000j",
          "constant_power_C": "290000+212000j",
          "constant_impedance_A": "0.00-28.8427j",
          "constant_impedance_B": "0.00-28.8427j",
          "constant_impedance_C": "0.00-28.8427j",
          "nominal_voltage": 2401.7771,
          "inline_comments": {
            "constant_impedance_A": "//Shunt Capacitors"
          }
        },
        {
          "name": "Load692",
          "phases": "ABCD",
          "voltage_A": 2401.7771,
          "voltage_B": "-1200.8886-2080.000j",
          "voltage_C": "-1200.8886+2080.000j",
          "constant_current_A": "0+0j",
          "constant_current_B": "0+0j",
          "constant_current_C": "-17.2414+51.8677j",
          "nominal_voltage": 2401.7771
        },
        {
          "name": "Load611",
          "phases": "CN",
          "voltage_A": 2401.7771,
          "voltage_B": "-1200.8886-2080.000j",
          "voltage_C": "-1200.8886+2080.000j",
          "constant_current_C": "-6.5443+77.9524j",
          "constant_impedance_C": "0.00-57.6854j",
          "nominal_voltage": 2401.7771,
          "inline_comments": {
            "constant_impedance_C": "//Shunt Capacitor"
          }
        },
        {
          "name": "Load6711",
          "parent": "Load671",
          "phases": "ABC",
          "voltage_A": 2401.7771,
          "voltage_B": "-1200.8886-2080.000j",
          "voltage_C": "-1200.8886+2080.000j",
          "constant_power_A": "5666.6667+3333.3333j",
          "constant_power_B": "22000+12666.6667j",
          "constant_power_C": "39000+22666.6667j",
          "nominal_voltage": 2401.7771,
          "outside_comments": [
            "// distributed load between node 632 and 671",
            "// 2/3 of load 1/4 of length down line: Kersting p.56"
          ]
        },
        {
          "name": "Load6321",
          "phases": "ABCN",
          "voltage_A": 2401.7771,
          "voltage_B": "-1200.8886-2080.000j",
          "voltage_C": "-1200.8886+2080.000j",
          "constant_power_A": "11333.333+6666.6667j",
          "constant_power_B": "44000+25333.3333j",
          "constant_power_C": "78000+45333.3333j",
          "nominal_voltage": 2401.7771
        },
        {
          "name": "Load680",
          "phases": "ABCN",
          "voltage_A": 2401.7771,
          "voltage_B": "-1200.8886-2080.000j",
          "voltage_C": "-1200.8886+2080.000j",
          "nominal_voltage": 2401.7771
        }
      ]
    },
    "switch": {
      "instances": [
        {
          "name": "switch1",
          "phases": "ABCN",
          "from": "Load671",
          "to": "Load692",
          "status": "CLOSED",
          "outside_comments": [
            "// Switch"
          ]
        }
      ]
    },
    "transformer": {
      "instances": [
        {
          "name": "XFMR1",
          "phases": "ABCN",
          "from": "Node633",
          "to": "Load634",
          "configuration": "transformer_configuration1",
          "outside_comments": [
            "// Transformer"
          ]
        }
      ]
    },
    "regulator": {
      "instances": [
        {
          "name": "Reg1",
          "phases": "ABC",
          "from": "Node650",
          "to": "Node630",
          "sense_node": "Load671",
          "configuration": "regulator_configuration1",
          "outside_comments": [
            "// Regulator"
          ]
        }
      ]
    },
    "voltdump": {
      "instances": [
        {
          "filename": "Volt_Dump_NR.csv"
        }
      ]
    },
    "currdump": {
      "instances": [
        {
          "filename": "Current_Dump_NR.csv"
        }
      ]
    },
    "recorder": {
      "instances": [
        {
          "parent": "Reg1",
          "file": "reg1_output.csv",
          "interval": 3600,
          "limit": 20,
          "property": "tap_A,tap_B,tap_C,power_in_A.real,power_in_A.imag,power_in_B.real,power_in_B.imag,power_in_C.real,power_in_C.imag,power_in.real,power_in.imag"
        }
      ]
    },
    "player": {
      "instances": [
        {
          "parent": "complex_assert_56",
          "property": "value",
          "file": "../fqm_constant_pq_power.player",
          "outside_comments": [
            "// Energy storage"
          ]
        },
        {
          "parent": "complex_assert_56",
          "property": "status",
          "file": "../fqm_constant_pq_status.player"
        },
        {
          "parent": "double_assert_61",
          "property": "value",
          "file": "../fqm_constant_pq_soc.player"
        },
        {
          "parent": "double_assert_61",
          "property": "status",
          "file": "../fqm_constant_pq_status.player"
        }
      ]
    },
    "complex_assert": {
      "instances": [
        {
          "name": "complex_assert_56",
          "parent": "battery_meter_1",
          "target": "measured_power",
          "within": 5.0
        }
      ]
    },
    "inverter": {
      "instances": [
        {
          "name": "battery_inverter_1",
          "inverter_type": "FOUR_QUADRANT",
          "four_quadrant_control_mode": "CONSTANT_PQ",
          "generator_mode": "CONSTANT_PQ",
          "generator_status": "ONLINE",
          "discharge_lockout_time": 1,
          "parent": "battery_meter_1",
          "rated_power": "15 kW",
          "inverter_efficiency": 0.95,
          "max_discharge_rate": "200 kW",
          "max_charge_rate": "300 kW",
          "P_Out": "CPQ_schedule",
          "Q_Out": "CPQ_schedule",
          "inline_comments": {
            "rated_power": "//Per phase rating"
          }
        }
      ]
    },
    "double_assert": {
      "instances": [
        {
          "name": "double_assert_61",
          "parent": "battery_1",
          "target": "state_of_charge",
          "within": 0.01
        }
      ]
    },
    "battery": {
      "instances": [
        {
          "name": "battery_1",
          "parent": "battery_inverter_1",
          "use_internal_battery_model": true,
          "battery_type": "LI_ION",
          "battery_capacity": "100 kWh",
          "base_efficiency": 1.0,
          "state_of_charge": 0.5,
          "generator_mode": "SUPPLY_DRIVEN"
        }
      ]
    }
  },
  "schedules": {
    "CPQ_schedule": [
      {
        "name": "",
        "items": [
          "* 0 * * * -15000",
          "* 1 * * * -20001",
          "* 2 * * * -25002",
          "* 3 * * * -20003",
          "* 4 * * * -10004",
          "* 5 * * * -10005",
          "* 6 * * * 10006",
          "* 7 * * * 10007",
          "* 8 * * * 20008",
          "* 9 * * * 30009",
          "* 10 * * * 15010",
          "* 11 * * * 40011",
          "* 12 * * * 50012",
          "* 13 * * * 20013",
          "* 14 * * * 5014",
          "* 15 * * * 10015",
          "* 16 * * * -10016",
          "* 17 * * * -10017",
          "* 18 * * * -20018",
          "* 19 * * * -30019",
          "* 20 * * * -40020",
          "* 21 * * * 5021",
          "* 22 * * * 25022",
          "* 23 * * * 35023"
        ]
      }
    ]
  }
}

docs/docs/7.0 References/Unimplemented/Neutral Earth Voltage/Spec_NEVLink.md

### Class: overhead_line_conductor

object overhead_line_conductor {
             name ohc1;
             diameter 1.2;
             geometric_mean_radius 0.01710;
             conductor_diameter 0.00446;
             resistance 1.12;
        }

### Class: underground_line_conductor

object underground_line_conductor {
             name ulc1;
             type CONCENTRIC_NEUTRAL;
             outer_diameter 1.29;
             conductor_gmr 0.01710;
             conductor_diameter 0.567;
             conductor_resistance 0.41;
             neutral_gmr 0.00208;
             neutral_diameter 0.0640837;
             neutral_resistance 14.872;
             neutral_strands 13;
        }

object underground_line_conductor {
             name ulc3;
             type INSULATED;
             outer_diameter 1.29;
             conductor_gmr 0.01710;
             conductor_diameter 0.567;
             conductor_resistance 0.41;
        }